{
  "entity": "activity_scheme_mapping",
  "policy": {
    "derivation_note": "NSFDC publishes ONE indicative activity taxonomy (S004) covering its credit schemes. The corpus does NOT state per-activity or per-scheme eligibility. Sector/activity membership is therefore mapped to the four income-generating schemes (MFS, TL, AMY, UNY) as UNVERIFIED, inherit-from-sector relationships. This is an ASSUMPTION, not a verified fact.",
    "verification_note": "Per-activity verification is a follow-on task (M2/Gemini + scheme documents). Until then, the Intelligence Engine must present activity-based eligibility as provisional and UNVERIFIED (PRD 40/25/20/15: Activity Match weight must not silently turn into a hard eligibility claim)."
  },
  "sector_mappings": [
    {
      "sector_id": "SECTOR-AGR",
      "activity_count": 20,
      "scheme_ids": [
        "NSFDC-MFS",
        "NSFDC-TL",
        "NSFDC-AMY",
        "NSFDC-UNY"
      ],
      "status": "UNVERIFIED",
      "evidence": [
        "S001",
        "S004"
      ],
      "derived": true,
      "notes": "Sector treated as indicative coverage for income-generating schemes; not a verified per-activity eligibility statement."
    },
    {
      "sector_id": "SECTOR-SII",
      "activity_count": 51,
      "scheme_ids": [
        "NSFDC-MFS",
        "NSFDC-TL",
        "NSFDC-AMY",
        "NSFDC-UNY"
      ],
      "status": "UNVERIFIED",
      "evidence": [
        "S001",
        "S004"
      ],
      "derived": true,
      "notes": "Sector treated as indicative coverage for income-generating schemes; not a verified per-activity eligibility statement."
    },
    {
      "sector_id": "SECTOR-STT",
      "activity_count": 77,
      "scheme_ids": [
        "NSFDC-MFS",
        "NSFDC-TL",
        "NSFDC-AMY",
        "NSFDC-UNY"
      ],
      "status": "UNVERIFIED",
      "evidence": [
        "S001",
        "S004"
      ],
      "derived": true,
      "notes": "Sector treated as indicative coverage for income-generating schemes; not a verified per-activity eligibility statement."
    }
  ],
  "activity_mappings": [
    {
      "activity_id": "ACT-001",
      "scheme_ids": [
        "NSFDC-MFS",
        "NSFDC-TL",
        "NSFDC-AMY",
        "NSFDC-UNY"
      ],
      "inherit_sector": true,
      "status": "UNVERIFIED",
      "evidence": [
        "S001",
        "S004"
      ],
      "derived": true,
      "notes": "Inherited from sector-level mapping (UNVERIFIED). Per-activity verification required."
    },
    {
      "activity_id": "ACT-002",
      "scheme_ids": [
        "NSFDC-MFS",
        "NSFDC-TL",
        "NSFDC-AMY",
        "NSFDC-UNY"
      ],
      "inherit_sector": true,
      "status": "UNVERIFIED",
      "evidence": [
        "S001",
        "S004"
      ],
      "derived": true,
      "notes": "Inherited from sector-level mapping (UNVERIFIED). Per-activity verification required."
    },
    {
      "activity_id": "ACT-003",
      "scheme_ids": [
        "NSFDC-MFS",
        "NSFDC-TL",
        "NSFDC-AMY",
        "NSFDC-UNY"
      ],
      "inherit_sector": true,
      "status": "UNVERIFIED",
      "evidence": [
        "S001",
        "S004"
      ],
      "derived": true,
      "notes": "Inherited from sector-level mapping (UNVERIFIED). Per-activity verification required."
    },
    {
      "activity_id": "ACT-004",
      "scheme_ids": [
        "NSFDC-MFS",
        "NSFDC-TL",
        "NSFDC-AMY",
        "NSFDC-UNY"
      ],
      "inherit_sector": true,
      "status": "UNVERIFIED",
      "evidence": [
        "S001",
        "S004"
      ],
      "derived": true,
      "notes": "Inherited from sector-level mapping (UNVERIFIED). Per-activity verification required."
    },
    {
      "activity_id": "ACT-005",
      "scheme_ids": [
        "NSFDC-MFS",
        "NSFDC-TL",
        "NSFDC-AMY",
        "NSFDC-UNY"
      ],
      "inherit_sector": true,
      "status": "UNVERIFIED",
      "evidence": [
        "S001",
        "S004"
      ],
      "derived": true,
      "notes": "Inherited from sector-level mapping (UNVERIFIED). Per-activity verification required."
    },
    {
      "activity_id": "ACT-006",
      "scheme_ids": [
        "NSFDC-MFS",
        "NSFDC-TL",
        "NSFDC-AMY",
        "NSFDC-UNY"
      ],
      "inherit_sector": true,
      "status": "UNVERIFIED",
      "evidence": [
        "S001",
        "S004"
      ],
      "derived": true,
      "notes": "Inherited from sector-level mapping (UNVERIFIED). Per-activity verification required."
    },
    {
      "activity_id": "ACT-007",
      "scheme_ids": [
        "NSFDC-MFS",
        "NSFDC-TL",
        "NSFDC-AMY",
        "NSFDC-UNY"
      ],
      "inherit_sector": true,
      "status": "UNVERIFIED",
      "evidence": [
        "S001",
        "S004"
      ],
      "derived": true,
      "notes": "Inherited from sector-level mapping (UNVERIFIED). Per-activity verification required."
    },
    {
      "activity_id": "ACT-008",
      "scheme_ids": [
        "NSFDC-MFS",
        "NSFDC-TL",
        "NSFDC-AMY",
        "NSFDC-UNY"
      ],
      "inherit_sector": true,
      "status": "UNVERIFIED",
      "evidence": [
        "S001",
        "S004"
      ],
      "derived": true,
      "notes": "Inherited from sector-level mapping (UNVERIFIED). Per-activity verification required."
    },
    {
      "activity_id": "ACT-009",
      "scheme_ids": [
        "NSFDC-MFS",
        "NSFDC-TL",
        "NSFDC-AMY",
        "NSFDC-UNY"
      ],
      "inherit_sector": true,
      "status": "UNVERIFIED",
      "evidence": [
        "S001",
        "S004"
      ],
      "derived": true,
      "notes": "Inherited from sector-level mapping (UNVERIFIED). Per-activity verification required."
    },
    {
      "activity_id": "ACT-010",
      "scheme_ids": [
        "NSFDC-MFS",
        "NSFDC-TL",
        "NSFDC-AMY",
        "NSFDC-UNY"
      ],
      "inherit_sector": true,
      "status": "UNVERIFIED",
      "evidence": [
        "S001",
        "S004"
      ],
      "derived": true,
      "notes": "Inherited from sector-level mapping (UNVERIFIED). Per-activity verification required."
    },
    {
      "activity_id": "ACT-011",
      "scheme_ids": [
        "NSFDC-MFS",
        "NSFDC-TL",
        "NSFDC-AMY",
        "NSFDC-UNY"
      ],
      "inherit_sector": true,
      "status": "UNVERIFIED",
      "evidence": [
        "S001",
        "S004"
      ],
      "derived": true,
      "notes": "Inherited from sector-level mapping (UNVERIFIED). Per-activity verification required."
    },
    {
      "activity_id": "ACT-012",
      "scheme_ids": [
        "NSFDC-MFS",
        "NSFDC-TL",
        "NSFDC-AMY",
        "NSFDC-UNY"
      ],
      "inherit_sector": true,
      "status": "UNVERIFIED",
      "evidence": [
        "S001",
        "S004"
      ],
      "derived": true,
      "notes": "Inherited from sector-level mapping (UNVERIFIED). Per-activity verification required."
    },
    {
      "activity_id": "ACT-013",
      "scheme_ids": [
        "NSFDC-MFS",
        "NSFDC-TL",
        "NSFDC-AMY",
        "NSFDC-UNY"
      ],
      "inherit_sector": true,
      "status": "UNVERIFIED",
      "evidence": [
        "S001",
        "S004"
      ],
      "derived": true,
      "notes": "Inherited from sector-level mapping (UNVERIFIED). Per-activity verification required."
    },
    {
      "activity_id": "ACT-014",
      "scheme_ids": [
        "NSFDC-MFS",
        "NSFDC-TL",
        "NSFDC-AMY",
        "NSFDC-UNY"
      ],
      "inherit_sector": true,
      "status": "UNVERIFIED",
      "evidence": [
        "S001",
        "S004"
      ],
      "derived": true,
      "notes": "Inherited from sector-level mapping (UNVERIFIED). Per-activity verification required."
    },
    {
      "activity_id": "ACT-015",
      "scheme_ids": [
        "NSFDC-MFS",
        "NSFDC-TL",
        "NSFDC-AMY",
        "NSFDC-UNY"
      ],
      "inherit_sector": true,
      "status": "UNVERIFIED",
      "evidence": [
        "S001",
        "S004"
      ],
      "derived": true,
      "notes": "Inherited from sector-level mapping (UNVERIFIED). Per-activity verification required."
    },
    {
      "activity_id": "ACT-016",
      "scheme_ids": [
        "NSFDC-MFS",
        "NSFDC-TL",
        "NSFDC-AMY",
        "NSFDC-UNY"
      ],
      "inherit_sector": true,
      "status": "UNVERIFIED",
      "evidence": [
        "S001",
        "S004"
      ],
      "derived": true,
      "notes": "Inherited from sector-level mapping (UNVERIFIED). Per-activity verification required."
    },
    {
      "activity_id": "ACT-017",
      "scheme_ids": [
        "NSFDC-MFS",
        "NSFDC-TL",
        "NSFDC-AMY",
        "NSFDC-UNY"
      ],
      "inherit_sector": true,
      "status": "UNVERIFIED",
      "evidence": [
        "S001",
        "S004"
      ],
      "derived": true,
      "notes": "Inherited from sector-level mapping (UNVERIFIED). Per-activity verification required."
    },
    {
      "activity_id": "ACT-018",
      "scheme_ids": [
        "NSFDC-MFS",
        "NSFDC-TL",
        "NSFDC-AMY",
        "NSFDC-UNY"
      ],
      "inherit_sector": true,
      "status": "UNVERIFIED",
      "evidence": [
        "S001",
        "S004"
      ],
      "derived": true,
      "notes": "Inherited from sector-level mapping (UNVERIFIED). Per-activity verification required."
    },
    {
      "activity_id": "ACT-019",
      "scheme_ids": [
        "NSFDC-MFS",
        "NSFDC-TL",
        "NSFDC-AMY",
        "NSFDC-UNY"
      ],
      "inherit_sector": true,
      "status": "UNVERIFIED",
      "evidence": [
        "S001",
        "S004"
      ],
      "derived": true,
      "notes": "Inherited from sector-level mapping (UNVERIFIED). Per-activity verification required."
    },
    {
      "activity_id": "ACT-020",
      "scheme_ids": [
        "NSFDC-MFS",
        "NSFDC-TL",
        "NSFDC-AMY",
        "NSFDC-UNY"
      ],
      "inherit_sector": true,
      "status": "UNVERIFIED",